{
  "contract": "monthly-profit-review@1.0",
  "meta": {"title": "示例店铺 2026-07 实际利润分析", "shop_name": "示例店铺", "month": "2026-07", "date_range": "2026-07-01 — 2026-07-31", "status": "含已确认估算", "external_images": "allow_https", "footer": "fixture"},
  "shop": {"name": "全店", "gross_revenue": 1000, "refund_amount": 100, "net_sales": 900, "goods_cost": 300, "freight_cost": 80, "actual_freight_amount": 78, "estimated_freight_amount": 2, "ad_spend": 250, "platform_fee": 54, "tax_cost": 18, "actual_profit": 198, "profit_margin": 0.22, "product_count": 2},
  "payment_flow": {"all_order_original_payment": 1020, "cancelled_order_original_payment": 20, "shipped_order_original_payment": 1000, "shipped_order_settled_refund": 100, "net_sales": 900, "cancelled_order_settled_refund": 20, "cancelled_order_refund_residual": 0},
  "owners": [{"id": "owner-1", "name": "负责人甲", "summary": {"name": "负责人甲", "gross_revenue": 800, "refund_amount": 80, "net_sales": 720, "goods_cost": 240, "freight_cost": 60, "actual_freight_amount": 58, "estimated_freight_amount": 2, "ad_spend": 200, "platform_fee": 43.2, "tax_cost": 14.4, "actual_profit": 162.4, "profit_margin": 0.2256, "product_count": 1, "payment_flow": {"all_order_original_payment": 820, "cancelled_order_original_payment": 20, "shipped_order_original_payment": 800, "shipped_order_settled_refund": 80, "net_sales": 720, "cancelled_order_settled_refund": 20, "cancelled_order_refund_residual": 0}}, "products": [{"id": "1001", "name": "示例商品", "owner": "负责人甲", "image_url": "https://img.alicdn.com/imgextra/example.jpg", "all_order_original_payment": 820, "cancelled_order_original_payment": 20, "gross_revenue": 800, "refund_amount": 80, "net_sales": 720, "goods_cost": 240, "freight_cost": 60, "ad_spend": 200, "post_refund_paid_ratio": 0.2777777778, "actual_profit": 162.4, "profit_margin": 0.2256}]}],
  "unowned": {"groups": [{"name": "未分配负责人", "gross_revenue": 200, "refund_amount": 20, "net_sales": 180, "goods_cost": 60, "freight_cost": 20, "actual_freight_amount": 20, "estimated_freight_amount": 0, "ad_spend": 50, "platform_fee": 10.8, "tax_cost": 3.6, "actual_profit": 35.6, "profit_margin": 0.1978, "product_count": 1, "payment_flow": {"all_order_original_payment": 200, "cancelled_order_original_payment": 0, "shipped_order_original_payment": 200, "shipped_order_settled_refund": 20, "net_sales": 180, "cancelled_order_settled_refund": 0, "cancelled_order_refund_residual": 0}}], "products": [{"id": "1002", "name": "未分配示例", "owner": "未分配负责人", "image_url": null, "all_order_original_payment": 200, "cancelled_order_original_payment": 0, "gross_revenue": 200, "refund_amount": 20, "net_sales": 180, "goods_cost": 60, "freight_cost": 20, "ad_spend": 50, "post_refund_paid_ratio": 0.2777777778, "actual_profit": 35.6, "profit_margin": 0.1978}]},
  "products": [{"id": "1001", "name": "示例商品", "owner": "负责人甲", "image_url": "https://img.alicdn.com/imgextra/example.jpg", "all_order_original_payment": 820, "cancelled_order_original_payment": 20, "gross_revenue": 800, "refund_amount": 80, "net_sales": 720, "goods_cost": 240, "freight_cost": 60, "ad_spend": 200, "post_refund_paid_ratio": 0.2777777778, "actual_profit": 162.4, "profit_margin": 0.2256}, {"id": "1002", "name": "未分配示例", "owner": "未分配负责人", "image_url": null, "all_order_original_payment": 200, "cancelled_order_original_payment": 0, "gross_revenue": 200, "refund_amount": 20, "net_sales": 180, "goods_cost": 60, "freight_cost": 20, "ad_spend": 50, "post_refund_paid_ratio": 0.2777777778, "actual_profit": 35.6, "profit_margin": 0.1978}],
  "quality": {"items": ["FREIGHT_ESTIMATED_BY_CONFIRMED_POLICY：1个运单，2.00元"], "method": ["平台费率6%，税率2%", "未匹配运单按每单2元估算"]}
}
